{
  "spacing-modifier": {
    "$value": "1",
    "$type": "utility",
    "$description": "Amount to multiply spacing variables by."
  },
  "line-height-modifier": {
    "$value": "1",
    "$type": "utility",
    "$description": "Amount to multiply line height variables by."
  },
  "letter-spacing-modifier": {
    "$value": "1",
    "$type": "utility",
    "$description": "Amount to multiply letter spacing variables by."
  },
  "fallback-font-size-modifier": {
    "$value": "1",
    "$type": "utility",
    "$description": "Fallback amount to multiply font size variables by in the event their specific modifier isn't set."
  },
  "transition-duration-modifier": {
    "$value": "1",
    "$type": "utility",
    "$description": "Amount to multiply transition durations by (automatically set to 0 with media query match for 'prefers-reduced-motion'"
  }
}
